{
  "schema_version": 1,
  "job_id": "speaker-routing-fixture-001",
  "recording": {
    "recording_id": "rec_fixture_speaker_routing_001",
    "duration_ms": 12000
  },
  "inputs": {
    "preprocess_result": {
      "path": "/srv/himr-media/derived/example/preprocess/result.json",
      "expected_sha256": "1111111111111111111111111111111111111111111111111111111111111111"
    },
    "asr_result": {
      "path": "/srv/himr-media/derived/example/asr/result.json",
      "expected_sha256": "2222222222222222222222222222222222222222222222222222222222222222"
    },
    "normalized_audio_sha256": "3333333333333333333333333333333333333333333333333333333333333333",
    "proxy_video_sha256": "4444444444444444444444444444444444444444444444444444444444444444",
    "glossary_sha256": "5555555555555555555555555555555555555555555555555555555555555555"
  },
  "reviewed_hints": {
    "path": "/srv/himr-media/review/speaker-reviewed-hints.example.json",
    "expected_sha256": "2e8aca71b111be8cd92478463c6491e301d8a9d5691ff0600aa3d7962d7af71b"
  },
  "capabilities": {
    "diarization": {
      "status": "unconfigured",
      "task": "overlap_aware_diarization",
      "reason": "No hash-pinned overlap-aware diarization model has been selected."
    },
    "face_tracking": {
      "status": "unconfigured",
      "task": "face_tracking",
      "reason": "No hash-pinned face tracking model has been selected."
    },
    "active_speaker": {
      "status": "unconfigured",
      "task": "active_speaker_association",
      "reason": "No hash-pinned active-speaker model and calibration artifact have been selected."
    }
  },
  "resources": {
    "cpu_threads": 8,
    "memory_mb": 16384,
    "gpu_available": false,
    "gpu_memory_mb": 0,
    "max_parallel_tasks": 1
  },
  "policy": {
    "diarization_chunk_ms": 300000,
    "face_chunk_ms": 120000,
    "active_speaker_chunk_ms": 60000,
    "route_visual_when_face_unknown": true
  },
  "output": {
    "result_path": "/srv/himr-media/derived/example/speaker-routing/result.json"
  }
}
